{
  "id": "C030",
  "kind": "catalog",
  "title": "The Ward Affair",
  "tier": 2,
  "dimension": "Asymmetry",
  "stage": "Control",
  "stratagems": [
    "S22",
    "S26"
  ],
  "theater": [
    "Psychological",
    "Legal",
    "Association"
  ],
  "spine": "Legal",
  "opponent": "The Party",
  "when": {
    "start": {
      "year": 1948,
      "month": null
    },
    "end": {
      "year": 1949,
      "month": null
    }
  },
  "gap": "Principles",
  "text": {
    "brief": "On November 20, 1948, Communist authorities in Mukden sealed the American consulate general and confined Consul General Angus Ward and his staff inside.",
    "record": "The Party held Ward and his staff under house arrest for about a year. In October 1949 it arrested Ward on a charge of assaulting a Chinese employee, convicted him and expelled him that December ([FRUS 1949, Vol. VIII, Document 1225: Consul General Clubb to the Secretary of State, October 29, 1949](https://history.state.gov/historicaldocuments/frus1949v08/d1225)). Washington protested and could do nothing else.",
    "reading": "The Party's first act toward American officials was detention, and it set the template for Downey, Fecteau and the Two Michaels. A hostage costs the taker little and freezes the other side's options.",
    "gapText": "Architecture Principles. The United States had no response package for detained diplomats, so each case waited for a fresh decision.",
    "fix": "Decide the response to a detained diplomat or citizen before it happens, and publish the price the jailer will pay."
  },
  "status": "sourced"
}
