{
  "id": "F072",
  "kind": "futures",
  "title": "The Frictionless Absorption",
  "tier": 5,
  "dimension": "Coherence",
  "stage": "Consume",
  "stratagems": [
    "S1"
  ],
  "theater": [
    "Economic",
    "Information",
    "Psychological",
    "AI and Cognitive"
  ],
  "spine": "AI and Cognitive",
  "opponent": "The Party",
  "when": {
    "start": {
      "year": 2038,
      "month": null
    },
    "end": {
      "year": 2049,
      "month": null
    }
  },
  "world": "Machine Mandate",
  "horizon": 3,
  "arc": "Taiwan",
  "gap": "Principles",
  "text": {
    "brief": "A retired teacher in Tainan takes a video call in 2044 from the AI tutor her granddaughter uses. The tutor speaks her Taiwanese Hokkien without an accent and asks, gently, why she still distrusts the mainland.",
    "record": "In the Election Study Center's survey at National Chengchi University, 62.0 percent of Taiwan's people identified as Taiwanese only in December 2025. The Party's rules for generative AI require services to uphold core socialist values. Alibaba's Qwen models were the most downloaded model family on Hugging Face in 2025.",
    "reading": "The Party absorbs Taiwan without a landing. Persuasion engines speak to each voter in her own dialect, trade and tourism bind each town and the change arrives as convenience. This is Stratagem 1, deceive the heavens to cross the sea.",
    "coreEvent": "A government in Taipei signs a political framework with the Party that names unification as its goal before 2049.",
    "gapText": "Architecture Principles. Democracies guard the ballot and leave unmarked the persuasion that comes before it.",
    "fix": "Label machine persuasion at the source, name its sponsor and leave lawful speech alone."
  },
  "status": "unsourced"
}
