{
  "id": "C055",
  "kind": "catalog",
  "title": "Democracy Wall",
  "tier": 3,
  "dimension": "Phase",
  "stage": "Accommodate",
  "stratagems": [
    "S16"
  ],
  "theater": [
    "Information",
    "Legal"
  ],
  "spine": "Information",
  "opponent": "The Party",
  "when": {
    "start": {
      "year": 1978,
      "month": null
    },
    "end": {
      "year": 1979,
      "month": null
    }
  },
  "gap": "Principles",
  "text": {
    "brief": "On December 5, 1978, the zoo electrician Wei Jingsheng posted The Fifth Modernization on the Xidan wall in Beijing.",
    "record": "The poster argued that the Party's Four Modernizations would fail without democracy. Deng Xiaoping tolerated the wall while its posters attacked his rivals and told foreign visitors that the constitution allowed them. In March 1979 Wei warned that Deng was becoming a new dictator, and police arrested him on March 29. A court sentenced him to fifteen years in October. In December the city moved the wall to a park and required every writer to register a name and workplace. In 1980 the National People's Congress struck the right to write big-character posters from the constitution.",
    "reading": "The Party let speech run while it served a struggle among leaders and closed the channel once the speech turned on the new leader, which is Stratagem 16. Wei's arrest came seven weeks after Deng left the United States, once normalization and the state visit had closed.",
    "gapText": "Architecture Principles. Washington read tolerance as reform and set no test for when the tolerance would end.",
    "fix": "Judge openness by what the state does to its critics after the visit ends, and say so in public."
  },
  "status": "unsourced"
}
