{
  "id": "C066",
  "kind": "catalog",
  "title": "Desert Storm Seen from Beijing",
  "tier": 4,
  "dimension": "Asymmetry",
  "stage": "Doctrine",
  "stratagems": [
    "S9"
  ],
  "theater": [
    "Kinetic",
    "Information",
    "Cyber"
  ],
  "spine": "Kinetic",
  "opponent": "The Party",
  "when": {
    "start": {
      "year": 1991,
      "month": null
    },
    "end": {
      "year": 1991,
      "month": null
    }
  },
  "gap": "Principles",
  "text": {
    "brief": "In January 1993 Jiang Zemin told the Central Military Commission that the army must prepare to win local wars under high-technology conditions.",
    "record": "Coalition forces had broken Iraq's army in 1991 after six weeks of air war and a hundred hours on the ground. Party military journals spent the years after on precision strike, satellites and battlefield networks. The 1993 guidelines made local war under high-technology conditions the basis for planning ([USCC testimony of Dean Cheng: PLA perspectives on network warfare in informationized local wars](https://www.uscc.gov/sites/default/files/2022-02/Dean_Cheng_Testimony.pdf); [Jamestown Foundation China Brief: China's new military strategy, winning informationized local wars (think tank)](https://jamestown.org/chinas-new-military-strategy-winning-informationized-local-wars/)). A 2004 revision changed the phrase to informatized conditions, and later defense white papers kept it ([PRC White Paper on China's National Defense in 2004 (FAS mirror)](https://nuke.fas.org/guide/china/doctrine/natdef2004.html); [Jamestown Foundation: China's Military Strategy 2015 (white paper text)](https://jamestown.org/wp-content/uploads/2016/07/China%E2%80%99s-Military-Strategy-2015.pdf)).",
    "reading": "The Party watched an American victory from across the river, which is Stratagem 9, and learned from it faster than the victors did. The lesson it drew was asymmetry, so it built missiles, satellites and cyber units to strike the networks that made American precision possible.",
    "gapText": "Architecture Principles. The United States showed its method to the world and assumed its lead would hold.",
    "fix": "Design every American advantage on the assumption that the opponent studies it, and harden the networks it depends on first."
  },
  "status": "sourced"
}
